{
  "task_type": "Agent多步骤执行",
  "goal": "检查项目目录，定位未完成事项并完成允许的低风险修复",
  "deliverable": "完成后的变更结果与验证证据",
  "audience": "项目维护者",
  "profile": "agent",
  "context": ["Agent可以读取文件、运行测试并修改项目文件"],
  "sources": ["项目目录", "测试输出", "错误日志"],
  "constraints": [
    "不得删除用户数据",
    "不得发布、推送或执行不可逆外部操作",
    "每次工具执行后根据实际结果更新状态",
    "最终完成状态必须由验证命令证明"
  ],
  "quality_gate": [
    "目标问题已处理",
    "相关测试通过",
    "没有新增明显错误",
    "报告包含实际验证结果"
  ],
  "language": "中文"
}
