{
  "task_type": "医学文献分析",
  "goal": "从多篇临床研究中提取可用于内部医学讨论的研究设计、PICO、主要终点、关键结果、安全性和局限",
  "deliverable": "结构化证据综述",
  "audience": "制药企业医学团队",
  "profile": "medical",
  "context": [
    "输入可能包含正文、补充材料和摘要",
    "不同研究可能使用不同终点定义"
  ],
  "sources": [
    "[S01] 研究A正文",
    "[S02] 研究A补充材料",
    "[S03] 研究B正文"
  ],
  "source_priority": [
    "正式发表的正文与补充材料",
    "注册平台或研究方案中的预设定义",
    "摘要或二手材料"
  ],
  "constraints": [
    "所有样本量、效应量、置信区间和P值必须可追溯到来源编号",
    "观察到的结果和模型解释分开表达",
    "来源之间定义不一致时逐项列出"
  ],
  "quality_gate": [
    "核对PICO和主要终点",
    "核对所有关键数字",
    "确认没有把探索性终点写成主要终点",
    "确认材料缺失处已标记"
  ],
  "output_format": "先给结论摘要，再给研究级证据表和局限",
  "language": "中文",
  "detail_level": "专业、可复核"
}
