{
  "task_type": "中文职场写作",
  "goal": "把零散记录整理成可以直接发送给内部团队的工作简报",
  "deliverable": "一段自然、清楚、专业的中文简报",
  "audience": "内部跨部门同事",
  "profile": "writing",
  "context": ["输入存在口语、重复和顺序混乱"],
  "sources": ["用户提供的原始记录"],
  "constraints": [
    "不增加原始记录中不存在的事实",
    "保留日期、数字、负责人和待办",
    "删除重复和无信息量表达"
  ],
  "quality_gate": [
    "重要事实无遗漏",
    "待办和责任人清楚",
    "语气适合内部书面沟通"
  ],
  "length": "500字以内",
  "language": "中文"
}
